<?xml version="1.0" encoding="UTF-8"?>
<?xml-stylesheet type="text/xsl" href="ximftoxul.xsl"?>
<ximf:instance name="Whirlpool" version="1.0" ximfVersion="2.0" xmlns:ximf="http://eads.org/ximf/" xmlns:xsi="http://www.w3.org/2001/XMLSchema-instance" xsi:schemaLocation="http://eads.org/ximf/ ximf.xsd">

	<!--  OID WHIRLPOOL -->
	<ximf:header id="header-policy-identifier" headerName="X-XIMF-Security-Policy-Identifier" >		
		<ximf:string content="1.2.840.113549.1.9.16.7.3"/>
	</ximf:header>
	
	<!-- Security Classification-->
	<ximf:header id="header-classification" 
				 headerName="X-XIMF-Security-Classification"
				 technicalHeaderName="X-XIMF-Security-Classification-Identifier"
				 type="string"
				 technicalType="oid"
				 ilk="ilk-classification"
				 isMandatory="true">
		<ximf:set id="value-whirlpool-classification">
			<ximf:string ilk="ilk-public" content="whirlpool-public" technicalContent="6" >	
				<ximf:linkedValue ref="value-privacy-mark-other" />
			</ximf:string>						
			<ximf:string ilk="ilk-internal" content="whirlpool-internal" technicalContent="7" >
				<ximf:linkedValue ref="value-privacy-mark-confidential" />
			</ximf:string>			
			<ximf:string ilk="ilk-confidential" content="whirlpool-confidential" technicalContent="8" >
				<ximf:linkedValue ref="value-privacy-mark-confidential" />
			</ximf:string>				
		</ximf:set>
	</ximf:header>	
	<ximf:header id="header-privacy-mark" headerName="X-XIMF-Privacy-Mark" ilk="ilk-privacy-mark" isMandatory="false">
		<ximf:set id="value-privacy-mark-confidential">
			<ximf:string ilk="MAKE NO COPY" content="MAKE NO COPY" />
			<ximf:string ilk="ATTORNEY-CLIENT PRIVILEGED DOCUMENT" content="ATTORNEY-CLIENT PRIVILEGED DOCUMENT" />
			<ximf:string ilk="THIRD PARTY CONFIDENTIAL" content="THIRD PARTY CONFIDENTIAL" />
			<ximf:compstring ilk="LIMITED TO" content="LIMITED TO" separator=" : ">
				<ximf:string editable="true" />
			</ximf:compstring>
			<ximf:string ilk="COVERED BY A NON-ANALYSIS AGREEMENT" content="COVERED BY A NON-ANALYSIS AGREEMENT" />
		</ximf:set>
		<ximf:set id="value-privacy-mark-other">
			<ximf:string ilk="SEND BY INTERNET" content="SEND BY INTERNET" />
			<ximf:string ilk="PRIVATE" content="PRIVATE" />
		</ximf:set>
	</ximf:header>
	
	<!-- headers unmandatories -->
	<ximf:header id="header-reply-before" headerName="X-XIMF-Reply-Before" ilk="ilk-reply-before" isMandatory="false" type="date">
		<ximf:string id="value-reply-before" editable="true" />
	</ximf:header>	
	
	<ximf:header id="header-originator-reference" headerName="X-XIMF-Originator-Reference" ilk="ilk-originator-reference" isMandatory="false" type="string">
		<ximf:string id="value-originator-reference" maxItem="10" editable="true" separator=" - "/>
	</ximf:header>
	
	<!-- Adresses exemptÃ©es -->
	<ximf:header id="header-exempted-address" headerName="X-XIMF-Exempted-Address" ilk="ilk-exempted-address" isMandatory="false" type="address">
		<ximf:string id="value-exempted-address" editable="true" />
	</ximf:header>

</ximf:instance>
