<?xml version="1.0" encoding="UTF-8"?>

<ximf:instance name="caterpillar" version="1.0" ximfVersion="2.0" xmlns:ximf="http://eads.org/ximf/" xmlns:xsi="http://www.w3.org/2001/XMLSchema-instance" xsi:schemaLocation="http://eads.org/ximf/ ximf.xsd">
	<ximf:rule id="compatibility-rule" description="Règle sur la compatibilités X-SMTP / XIMF" >
		<ximf:association>
				<ximf:aliasHeader headerName="X-XIMF-Copy-Precedence" headerRef="X-XIMF-Primary-Precedence">				
				<ximf:aliasValue valueName="routine" valueRef="routine" />
				<ximf:aliasValue valueName="routine" valueRef="priority" />
				<ximf:aliasValue valueName="routine,priority" valueRef="immediate" />
				<ximf:aliasValue valueName="routine,priority,immediate" valueRef="flash" />
				</ximf:aliasHeader>
		</ximf:association>
	</ximf:rule>
	<ximf:rule id="label-pictures-rule" description="rule to display pictures on received mails" >	
		<ximf:classificationPictures targetName="ClassificationPictures">
			<ximf:aliasHeader headerName="url" headerRef="X-XIMF-Security-Classification-Identifier" >					
				<ximf:aliasValue valueRef="7" valueName="chrome://ximf-conpany-def/content/CaterpillarInc/resource/caterpillar-green.png" />
				<ximf:aliasValue valueRef="8" valueName="chrome://ximf-conpany-def/content/CaterpillarInc/resource/caterpillar-yellow.png" />
				<ximf:aliasValue valueRef="9" valueName="chrome://ximf-conpany-def/content/CaterpillarInc/resource/caterpillar-red.png" />				
			</ximf:aliasHeader>
		</ximf:classificationPictures>		
	</ximf:rule>
</ximf:instance>
