<?xml version="1.0" encoding="UTF-8"?>
<?xml-stylesheet type="text/xsl" href="ximftoxul.xsl"?>
<ximf:instance name="Caterpillar" version="1.0" ximfVersion="2.0" xmlns:ximf="http://eads.org/ximf/" xmlns:xsi="http://www.w3.org/2001/XMLSchema-instance" xsi:schemaLocation="http://eads.org/ximf/ ximf.xsd">

	<!--  OID CATERPILLAR -->
	<ximf:header id="header-policy-identifier" headerName="X-XIMF-Security-Policy-Identifier" >		
		<ximf:string content="1.2.840.113549.1.9.16.7.2"/>
	</ximf:header>
	
	<!-- Security Classification-->
	<ximf:header id="header-classification" 
				 headerName="X-XIMF-Security-Classification"
				 technicalHeaderName="X-XIMF-Security-Classification-Identifier"
				 type="string"
				 technicalType="oid"
				 ilk="ilk-classification"
				 isMandatory="true">
		<ximf:set id="value-caterpillar-classification">
			<ximf:string ilk="ilk-public" content="caterpillar-public" technicalContent="6" />			
			<ximf:string ilk="ilk-confidential-green" content="caterpillar-green" technicalContent="7" />
			<ximf:string ilk="ilk-confidential-yellow" content="caterpillar-yellow" technicalContent="8" />
			<ximf:string ilk="ilk-confidential-red" content="caterpillar-red" technicalContent="9" />				
		</ximf:set>
	</ximf:header>
	
	<!-- headers advanced -->
	<ximf:header id="header-primary-precedence" headerName="X-XIMF-Primary-Precedence" ilk="ilk-primary-precedence" isMandatory="true">
		<ximf:set id="value-precedence">
			<ximf:string id="data-routine-precedence" ilk="ilk-routine" content="routine" index="0"  aclLevel="30"/>
			<ximf:string id="data-urgent-precedence" ilk="ilk-urgent" content="priority" index="1"  aclLevel="40"/>
			<ximf:string id="data-immediat-precedence" ilk="ilk-immediat" content="immediate" index="2"  aclLevel="50"/>
			<ximf:string id="data-flash-precedence" ilk="ilk-flash" content="flash" index="3"  aclLevel="100"/>
		</ximf:set>
	</ximf:header>
	
	<ximf:header id="header-copy-precedence" headerName="X-XIMF-Copy-Precedence" ilk="ilk-copy-precedence" isMandatory="false">
		<ximf:set ref="value-precedence"/>
	</ximf:header>
	
	<!-- attribution -->	
	<ximf:header id="header-akw" headerName="X-XIMF-Attribution-Key-Word" ilk="ilk-akw" type="string">
		<ximf:set ref="attribution-list.xml" separator=";" maxItem="2"/>
	</ximf:header>	
	
</ximf:instance>
