<?xml version="1.0" encoding="UTF-8"?>
<?xml-stylesheet type="text/xsl" href="ximftoxul.xsl"?>
<ximf:instance name="Amoco" version="1.0" ximfVersion="2.0" xmlns:ximf="http://eads.org/ximf/" xmlns:xsi="http://www.w3.org/2001/XMLSchema-instance" xsi:schemaLocation="http://eads.org/ximf/ ximf.xsd">

	<!--  OID AMOCO -->
	<ximf:header id="header-policy-identifier" headerName="X-XIMF-Security-Policy-Identifier" >		
		<ximf:string content="1.2.840.113549.1.9.16.7.1"/>
	</ximf:header>
	
	<!-- Security Classification-->
	<ximf:header id="header-classification" 
				 headerName="X-XIMF-Security-Classification"
				 technicalHeaderName="X-XIMF-Security-Classification-Identifier"
				 type="string"
				 technicalType="oid"
				 ilk="ilk-classification"
				 isMandatory="true">
		<ximf:set id="value-amoco-classification">
			<ximf:string ilk="ilk-general" content="amoco-general" technicalContent="6" />			
			<ximf:string ilk="ilk-confidential" content="amoco-confidential" technicalContent="7" />
			<ximf:string ilk="ilk-highly-confidential" content="amoco-highly-confidential" technicalContent="8" />				
		</ximf:set>
	</ximf:header>
	
	<ximf:header id="header-privacy-mark" headerName="X-XIMF-Privacy-Mark" ilk="ilk-privacy-mark" isMandatory="true">
		<ximf:set id="value-privacy-mark">
			<ximf:string ilk="ilk-minimum" content="amoco-minimum" />
			<ximf:string ilk="ilk-medium" content="amoco-medium" />
			<ximf:string ilk="ilk-maximum" content="amoco-maximum" />
			<ximf:string ilk="ilk-critical" content="amoco-critical" />
		</ximf:set>
	</ximf:header>
	
	<!-- headers advanced -->
		<!-- headers advanced -->
	<ximf:header id="header-primary-precedence" headerName="X-XIMF-Primary-Precedence" ilk="ilk-primary-precedence" isMandatory="true">
		<ximf:set id="value-precedence">
			<ximf:string id="data-routine-precedence" ilk="ilk-routine" content="routine" index="0"  aclLevel="30"/>
			<ximf:string id="data-urgent-precedence" ilk="ilk-urgent" content="priority" index="1"  aclLevel="40"/>
			<ximf:string id="data-immediat-precedence" ilk="ilk-immediat" content="immediate" index="2"  aclLevel="50"/>
			<ximf:string id="data-flash-precedence" ilk="ilk-flash" content="flash" index="3"  aclLevel="100"/>
		</ximf:set>
	</ximf:header>
	
	<ximf:header id="header-copy-precedence" headerName="X-XIMF-Copy-Precedence" ilk="ilk-copy-precedence" isMandatory="false">
		<ximf:set ref="value-precedence"/>
	</ximf:header>
	
	<ximf:header id="header-reply-before" headerName="X-XIMF-Reply-Before" ilk="ilk-reply-before" isMandatory="false" type="date">
		<ximf:string id="value-reply-before" editable="true" />
	</ximf:header>	
	
	<ximf:header id="header-originator-reference" headerName="X-XIMF-Originator-Reference" ilk="ilk-originator-reference" isMandatory="false" type="string">
		<ximf:string id="value-originator-reference" maxItem="5" editable="true" separator=";"/>
	</ximf:header>
	
</ximf:instance>
